{
  "model_id": "de_natrm_final_release_pr90_20260423",
  "probabilities": {
    "Standard": 0.0,
    "De-escalation": 0.0
  },
  "recommended_treatment": "Standard",
  "recommended_probability": 0.0,
  "selected_threshold": 0.4630236625671386,
  "threshold_strategy": "precision_at_recall",
  "positive_at_threshold": {
    "Standard": false,
    "De-escalation": false
  },
  "missing_input_features": [
    "roi_multifocal_any",
    "mr_lesion_count",
    "pet_lesion_count",
    "mr_total_roi_volume_ml",
    "mr_bbox_max_dim_mm",
    "mr_z_span_mm",
    "mr_max_slice_area_mm2",
    "pet_total_roi_volume_ml",
    "pet_bbox_max_dim_mm",
    "pet_z_span_mm",
    "pet_max_slice_area_mm2",
    "pet_suvbw_mean",
    "pet_suvbw_max",
    "pet_tlg",
    "log_pet_mr_volume_ratio",
    "pet_rad_original_shape_elongation",
    "pet_rad_original_shape_leastaxislength",
    "pet_rad_original_shape_maximum2ddiameterrow",
    "pet_rad_original_shape_maximum2ddiameterslice",
    "pet_rad_original_shape_minoraxislength",
    "pet_rad_original_shape_surfacevolumeratio",
    "roi_comp_pet_metabolic_density",
    "roi_comp_pet_suvmax_to_mr_dim",
    "roi_comp_pet_mr_volume_ratio_raw",
    "roi_comp_pet_mr_zspan_ratio",
    "roi_comp_pet_mr_maxarea_ratio",
    "roi_comp_pet_mr_lesion_delta",
    "roi_comp_pet_suvmean_to_mr_vol"
  ],
  "warnings": [
    "ROI branch gated to zero because mr_roi_available/pet_roi_available/roi_ambiguous_series do not indicate a valid paired ROI."
  ]
}
